{
  "$schema": "./evidence.schema.json",
  "schema_version": "1.1.0",
  "project": {
    "slug": "ucm-daily-register",
    "name": "UCM Daily Register",
    "repository": "https://github.com/ui-insight/UCMDailyRegister",
    "evidence_label": "standards-evidence",
    "issue_tracker": {
      "type": "github",
      "owner": "ui-insight",
      "repo": "UCMDailyRegister",
      "parent_issue": {
        "number": 170,
        "url": "https://github.com/ui-insight/UCMDailyRegister/issues/170",
        "state": "open"
      },
      "evidence_query_url": "https://github.com/ui-insight/UCMDailyRegister/issues?q=is%3Aissue%20label%3Astandards-evidence"
    }
  },
  "framework": {
    "id": "uidaho-oit-enterprise-ai-development-framework",
    "title": "University of Idaho Enterprise AI Development Framework",
    "version": "discussion-draft-2026-04",
    "source_url": "https://dev.azure.com/uidaho/Development/_wiki/wikis/Development.wiki/19540/Enterprise-AI-Development-Framework",
    "source_status": "discussion_draft",
    "published_at": "2026-04-01"
  },
  "ingestion": {
    "canonical_manifest_path": "docs/governance/enterprise-ai-framework/evidence.json",
    "raw_manifest_url": "https://raw.githubusercontent.com/ui-insight/UCMDailyRegister/main/docs/governance/enterprise-ai-framework/evidence.json",
    "schema_path": "docs/governance/enterprise-ai-framework/evidence.schema.json",
    "primary_key": "project.slug + framework.id + requirements[].id",
    "refresh_strategy": "Fetch this manifest from main, then refresh linked GitHub issue state by issue number.",
    "github_status_source": "GitHub issue state is authoritative for work status; current_assertion is authoritative for compliance assertion status."
  },
  "status_values": [
    {
      "status": "not_started",
      "meaning": "No compliance claim has been validated yet."
    },
    {
      "status": "aligned",
      "meaning": "UCM Daily Register appears to meet the requirement and has evidence ready for review."
    },
    {
      "status": "partially_aligned",
      "meaning": "UCM Daily Register meets part of the requirement, but needs more implementation, validation, or evidence."
    },
    {
      "status": "gap",
      "meaning": "UCM Daily Register does not currently meet the requirement."
    },
    {
      "status": "not_applicable",
      "meaning": "The requirement does not apply to UCM Daily Register, with rationale captured in evidence."
    },
    {
      "status": "needs_decision",
      "meaning": "Compliance depends on an OIT, security, product ownership, or governance decision."
    }
  ],
  "requirements": [
    {
      "id": "OIT-EAI-STACK",
      "title": "Approved technology stack alignment",
      "category": "approved_technology_stack",
      "aispeg_standard_ids": [
        "i-1",
        "i-7"
      ],
      "requirement_summary": "Validate UCM Daily Register against the approved stack, including FastAPI, React/Vite/TypeScript, PostgreSQL, SQLAlchemy/Alembic, Python and JavaScript tooling, testing, CI/CD, GitOps, source control, auth, secrets, observability, and AI gateway/model choices.",
      "current_assertion": {
        "status": "partially_aligned",
        "summary": "FastAPI/Uvicorn, React/Vite/TypeScript, SQLAlchemy/Alembic, pytest, Vitest, Compose and GitHub Actions are present. Entra OIDC is implemented alongside header mode. Approved deployment tooling, secrets integration, full observability and model/gateway decisions remain unverified.",
        "validated_at": "2026-10-22",
        "validated_by": "Codex repository review; institutional approval not asserted"
      },
      "github_issue": {
        "number": 171,
        "url": "https://github.com/ui-insight/UCMDailyRegister/issues/171",
        "state": "open"
      },
      "evidence_sources": [
        {
          "type": "repo_file",
          "label": "Approved stack evidence matrix",
          "path": "docs/governance/enterprise-ai-framework/approved-stack-evidence.md"
        },
        {
          "type": "repo_file",
          "label": "Backend dependency manifest",
          "path": "backend/pyproject.toml"
        },
        {
          "type": "repo_file",
          "label": "Frontend dependency manifest",
          "path": "frontend/package.json"
        },
        {
          "type": "repo_directory",
          "label": "GitHub Actions workflows",
          "path": ".github/workflows"
        },
        {
          "type": "repo_file",
          "label": "Docker Compose deployment",
          "path": "docker-compose.yml"
        },
        {
          "type": "repo_file",
          "label": "Governance decisions and unverified environment evidence",
          "path": "docs/governance/decisions.md"
        }
      ],
      "required_evidence": [
        "Approved-stack matrix with one row per OIT stack item",
        "Validation commands and latest successful outputs",
        "Exception or follow-up links for any deviations"
      ],
      "blockers": [],
      "tags": [
        "deployment",
        "code-quality",
        "documentation"
      ]
    },
    {
      "id": "OIT-EAI-AUTH",
      "title": "Microsoft Entra ID OIDC production authentication",
      "category": "authentication",
      "aispeg_standard_ids": [
        "i-1",
        "i-2",
        "i-4"
      ],
      "requirement_summary": "Production authentication must use Microsoft Entra ID through OAuth2/OIDC, with applications designed to be auth-provider-agnostic and without custom production auth.",
      "current_assertion": {
        "status": "partially_aligned",
        "summary": "Entra confidential-client OIDC, claim/Graph role mapping, signed app sessions and authorization tests are implemented. Header prototype mode remains the default. Live enablement, registration/consent, role assignments and institutional approval require per-environment evidence; no production alignment is asserted.",
        "validated_at": "2026-10-22",
        "validated_by": "Codex repository review; institutional approval not asserted"
      },
      "github_issue": {
        "number": 172,
        "url": "https://github.com/ui-insight/UCMDailyRegister/issues/172",
        "state": "open"
      },
      "evidence_sources": [
        {
          "type": "repo_file",
          "label": "Security policy authentication section",
          "path": "SECURITY.md"
        },
        {
          "type": "repo_file",
          "label": "API dependency trusted role logic",
          "path": "backend/app/api/deps.py"
        },
        {
          "type": "repo_file",
          "label": "Deployment trusted auth boundary notes",
          "path": "docs/deployment.md"
        },
        {
          "type": "repo_file",
          "label": "Authorization tests",
          "path": "backend/tests/test_authorization.py"
        },
        {
          "type": "repo_file",
          "label": "Governance decisions and unverified environment evidence",
          "path": "docs/governance/decisions.md"
        },
        {
          "type": "repo_file",
          "label": "Entra implementation and tests",
          "path": "backend/app/api/v1/sso.py"
        },
        {
          "type": "repo_file",
          "label": "SSO tests",
          "path": "backend/tests/test_auth_sso.py"
        }
      ],
      "required_evidence": [
        "OIDC adapter implementation and tests or approved exception",
        "Role/group claim mapping",
        "Production configuration guide",
        "OIT Entra app registration decision"
      ],
      "blockers": [
        "OIT decision on Entra app registration ownership, group names, and trusted gateway claim contract"
      ],
      "tags": [
        "security",
        "integration",
        "deployment"
      ]
    },
    {
      "id": "OIT-EAI-CICD",
      "title": "Azure Pipelines, ArgoCD, and Kustomize deployment path",
      "category": "cicd_gitops",
      "aispeg_standard_ids": [
        "i-5",
        "i-8"
      ],
      "requirement_summary": "Hosted deployments should use Azure Pipelines, ArgoCD, Kustomize, OIT-provisioned namespaces, and no direct cluster access in test or production.",
      "current_assertion": {
        "status": "gap",
        "summary": "The repository has GitHub Actions CI and Docker Compose deployment documentation for the openera host. It does not contain Azure Pipelines, ArgoCD application definitions, Kustomize overlays, or OIT namespace/RBAC evidence.",
        "validated_at": "2026-10-22",
        "validated_by": "Codex repository review; institutional approval not asserted"
      },
      "github_issue": {
        "number": 173,
        "url": "https://github.com/ui-insight/UCMDailyRegister/issues/173",
        "state": "open"
      },
      "evidence_sources": [
        {
          "type": "repo_file",
          "label": "Deployment guide",
          "path": "docs/deployment.md"
        },
        {
          "type": "repo_file",
          "label": "Docker Compose deployment file",
          "path": "docker-compose.yml"
        },
        {
          "type": "repo_file",
          "label": "Deploy script",
          "path": "deploy.sh"
        },
        {
          "type": "repo_directory",
          "label": "GitHub Actions workflows",
          "path": ".github/workflows"
        },
        {
          "type": "repo_file",
          "label": "Governance decisions and unverified environment evidence",
          "path": "docs/governance/decisions.md"
        }
      ],
      "required_evidence": [
        "Azure Pipeline YAML or deployment repository link",
        "ArgoCD application evidence",
        "Kustomize overlays",
        "Image digest and namespace/RBAC evidence"
      ],
      "blockers": [
        "OIT namespace provisioning",
        "OIT decision on GitHub Actions/GitHub Enterprise approval for this application"
      ],
      "tags": [
        "deployment",
        "integration",
        "documentation"